{
  "schema_version": "closure_package_exit_envelope_v1",
  "registry_schema_major": "closure_work_packages_v1",
  "registry_digest": "91ff84bf923dbbfb996a61ceec08a77d19bdd5300282002176cdd6a0bf158550",
  "package_id": "W1",
  "package_revision": 1,
  "native_receipt_schema_id": "int_v5a_recheck_report_v1",
  "native_receipt": {
    "root": "repo",
    "path": "closure/registry/native/W1-int-v5a-recheck.md",
    "sha256": "551e2036b27303c22a3a8def11bea814db0c34a16d431b29f7e4018d1bc34cd7"
  },
  "native_receipt_digest": "551e2036b27303c22a3a8def11bea814db0c34a16d431b29f7e4018d1bc34cd7",
  "status": "DONE",
  "subject_schema_id": "int_v5a_subject_v1",
  "subject": [
    {
      "key": "implementation_head",
      "value_type": "git_sha",
      "value": "ba2c36360584bcca8260d57c2be4c9294f82f8a5"
    },
    {
      "key": "recheck_sha256",
      "value_type": "sha256",
      "value": "551e2036b27303c22a3a8def11bea814db0c34a16d431b29f7e4018d1bc34cd7"
    }
  ]
}
